[{"id":"ab3c6f0cd26908d640da9cf1b48e383e","document_id":"13cde8071c1773c37afe3f355432f52f","remote_id":"","file_name":"Test.pdf","media_link":"https://api.docparser.com/v1/document/media/R4nX1iaCVbWzCYQld9iHWUUw57i_vZmvq1qky8wQVtLeHK1wVc4eOKIz1mL6XMsC8ddVZHVVVjEHsm7QVNAtIXbmVl2gIhyHUVo-lfMkoJc","media_link_original":"https://api.docparser.com/v1/document/media/R4nX1iaCVbWzCYQld9iHWUUw57i_vZmvq1qky8wQVtLeHK1wVc4eOKIz1mL6XMsC8ddVZHVVVjEHsm7QVNAtIXbmVl2gIhyHUVo-lfMkoJc/original","media_link_data":"https://api.docparser.com/v1/document/media/R4nX1iaCVbWzCYQld9iHWUUw57i_vZmvq1qky8wQVtLeHK1wVc4eOKIz1mL6XMsC8ddVZHVVVjEHsm7QVNAtIXbmVl2gIhyHUVo-lfMkoJc/data","page_count":2,"uploaded_at":"2022-11-30T00:36:57+00:00","processed_at":"2022-11-30T00:37:02+00:00","uploaded_at_utc":"2022-11-30T00:36:57+00:00","uploaded_at_user":"2022-11-29T16:36:57+00:00","processed_at_utc":"2022-11-30T00:37:02+00:00","processed_at_user":"2022-11-29T16:37:02+00:00","prepname":"Rajeshkumar.P","prepstart":"06:25:30","prepdate":null,"custname":"The Edge Treatment","custstate":"CA","custtaxid":"32-0572774","custnpi":{"match":"1417425604"},"subname":"Cindy Tran","subssn":null,"subdob":null,"subemail":null,"subphone":null,"ptname":null,"ptssn":null,"ptdob":null,"ptrelationship":"N/A","subgenderfemale":{"value":0,"confidence":0},"subgendermale":{"value":0,"confidence":0},"ptgenderfemale":{"value":0,"confidence":0},"ptgendermale":{"value":0,"confidence":98},"polinsurer":"FL Blue","polplantype":"PPO","polphonenumber":"(800) 676-2583","polmemberid":"VMAH22370799","polgroupnumber":"99999UU5","polterm":"Calendar Year","pcname":"New Directions","pcfaxurl":null,"tjcdtx":{"value":"Yes","confidence":90},"bhname":null,"bhid":null,"poleffective":null,"bhphone":null,"polexpires":null,"bhaddress":"PO BOX 60007 Los Angeles, CA 90060","polsponsor":"Self","bhpayorid":{"match":"47198"},"polemployer":null,"polfundedfully":{"value":"No","confidence":0},"polfundedself":{"value":"No","confidence":0},"polcobnotes":"COB needs to be updated.","polprimaryyes":{"value":"No","confidence":0},"polprimaryno":{"value":"No","confidence":0},"polcobyes":{"value":"No","confidence":0},"polcobno":{"value":"No","confidence":0},"accreditationyes":{"value":"No","confidence":0},"accreditationno":{"value":0,"confidence":0},"tjcrtc":{"value":0,"confidence":0},"tjcphp":{"value":0,"confidence":0},"tjciop":{"value":0,"confidence":0},"rnrequiredyes":{"value":0,"confidence":0},"rnrequiredno":{"value":0,"confidence":0},"lvnrequiredyes":{"value":0,"confidence":0},"graceyes":{"value":"No","confidence":0},"maxperiod":"N/A","graceno":{"value":0,"confidence":99},"cobrayes":{"value":"No","confidence":98},"cobrano":{"value":"No","confidence":0},"maxyes":{"value":"No","confidence":0},"maxno":{"value":"No","confidence":0},"maxdyes":{"value":"No","confidence":0},"maxdno":{"value":"No","confidence":0},"maxdetails":null,"maxddetails":"90 days","outofstatebenefitsyes":{"value":"No","confidence":0},"outofstatebenefitsno":{"value":"No","confidence":0},"pcpenalty":"case should be reported prior to service .","pcnotificationpenalty":"Denial .","paymentrecipientmember":{"value":"No","confidence":0},"paymentrecipientfaculty":{"value":"No","confidence":0},"paymentaobsyes":{"value":"No","confidence":0},"paymentaobsno":{"value":"No","confidence":0},"respnotes":"No Carryover applies.","dedcombinedyescombined":{"value":"No","confidence":0},"dedcombinednoseparate":{"value":"No","confidence":0},"crossaccumulatedyes":{"value":"No","confidence":0},"crossaccumulatedno":{"value":"No","confidence":0},"indoonapplies":{"value":"No","confidence":99},"famapplies":{"value":"No","confidence":0},"famoonapplies":{"value":"No","confidence":99},"resptable":[{"key_0":"-","key_1":"Max","key_2":"-","key_3":"Max","key_4":"Met","key_5":"Max","key_6":"-","key_7":"Max","key_8":"Met"},{"key_0":"Deductible","key_1":"-","key_2":"-","key_3":"$16,000.00","key_4":"$2779.60","key_5":"N/A","key_6":"N/A","key_7":"N/A","key_8":"N/A"},{"key_0":"OOP","key_1":"-","key_2":"-","key_3":"$17,100.00","key_4":"$2779.60","key_5":"N/A","key_6":"N/A","key_7":"N/A","key_8":"N/A"}],"nomaxoop":{"value":"No","confidence":99},"4thqtrcarryoverapplies":{"value":"No","confidence":99},"reimbursmenttable":[{"key_0":"SAD","key_1":"-","key_2":"50%","key_3":"-","key_4":"-","key_5":"-","key_6":"-"},{"key_0":"SAD","key_1":"-","key_2":"50%","key_3":"-","key_4":"-","key_5":"-","key_6":"-"},{"key_0":"RTC","key_1":"-","key_2":"50%","key_3":"-","key_4":"50%","key_5":"-","key_6":"-"},{"key_0":"RTC","key_1":"-","key_2":"0%","key_3":"-","key_4":"0%","key_5":"-","key_6":"-"},{"key_0":"IOP","key_1":"-","key_2":"50%","key_3":"-","key_4":"50%","key_5":"-","key_6":"-"},{"key_0":"OP","key_1":"-","key_2":"50%","key_3":"-","key_4":"50%","key_5":"-","key_6":"-"},{"key_0":"UAs","key_1":"-","key_2":"50%","key_3":"-","key_4":"50%","key_5":"-","key_6":"-"}],"reimbursementnotes":null,"schratetable":"Local Pricing","schratesubtable":null,"repricing":null,"summarynotes":null,"rep1name":"Ryan. U","rep1company":"FL Blue","rep1ref":"1-54101900063.","rep2name":null,"rep2company":null,"rep2ref":null,"prepend":"Prepared by Rajeshkumar.P\nDate 07.16.2021\nStart Time 06:25:30\n\nFacility\nName\n\nThe Edge Treatment\n\nState CA\n\nTax ID 32-0572774\n\nNPI 1417425604\n\nSubscriber\nName\n\nCindy Tran\n\nDOB 10.31.1991\n\nSSN\n\nAddress 726 PRESTWICK DRNICEVILLE, FL 32578\n\nGender\n\nEmail\n\n☐F ☐M\n\nPhone\n\nPatient\nName\n\nSSN\nRelationship\n\nDOB\n\nN/A\n\nGender\n\n☐F ☐M\n\nPolicy\nInsurer FL Blue\nMember ID VMAH22370799\n\nPlan Type\n\nPrimary\n\nEffective 01.01.2021\nExpires 05.31.2021\n\nFax/URL\n\nPhone #\n\nBH ID\n\nPhone #\n\nCarve Out Insurer\n\nPlan Sponsor\n\nPhone # (800) 676-2583\n\nGroup # 99999UU5\nExpiry Term Calendar Year\n\nPre-Cert Company New Directions\n\nBH Claims Address\n\nPPO\n\nPO BOX 60007 Los Angeles, CA 90060\n\nSelf\n\nFunded\n\n☐Y ☐N\n\nCOB on file\n\nPayor ID\n\n☐Fully ☐Self\n☐Y ☐N\n\n(866) 287-9569\n47198\n\nEmployer\nDetails COB needs to be updated.\n\nFlags and Limitations\nTJC/CARF Required\n\n☐Y ☐N\n\n☐DTX ☐RTC ☐PHP ☐IOP\n\nIn Grace Period\n\n☐Y ☐N\n\nPeriodic maximums\n\n☐Y ☐N\n\nLast Payment 05.31.2021\nN/A\nTime Period\n\nLimitations on # days\n\n☐Y ☐N\n\n☐Y ☐N\n\n☐Member ☐Facility\n✔\n\nLVN Required\n\n☐Y ☐N\n\nCOBRA\n\n☐Y ☐N\n\nOut of state benefits\n\n☐Y ☐N\n\nDetails\n\nDetails 90 days\n\nNotification Requirement case should be reported prior to service .\nPayments go to\n\nRN Required\n\nPre-Cert Penalty\n\nAre AOBs accepted\n\n☐Y ☐N\n\nDenial .\n\n✔\n\n____________________________ Page 2\n\nPatient Responsibility\nDoes deductible apply to OOP\n\n☐Yes/Combined ☐No/Separate\n\nDo IN and OON cross accumulate\nFamily\n\nIndividual\n\n☐ N/A\n\nOON ☐ N/A\nMax\n\n☐Y ☐N\n\nOON ☐ N/A\n\nMax\n\nMet\n\nMax\n\nDeductible\n\n$16,000.00\n\n$2779.60\n\nN/A\n\nOOP\n\n$17,100.00\n\n$2779.60\n\nN/A\n\nMax\n\nMet\n\nN/A\n\nN/A\n\nN/A\n\nN/A\n\nN/A\n\nN/A\n\nNotes No Carryover applies.\n\n☐ No Max OOP ☐ 4th quarter carryover applies\n\nReimbursement\nSubstance Abuse\nIN\n\nMental Health\n\nSAD\n\n50%\n\nCo-Pay\n-\n\nSAD\n\n50%\n\n-\n\nRTC\n\n50%\n\n50%\n\n-\n\nRTC\n\n0%\n\n0%\n\n-\n\nIOP\n\n50%\n\n50%\n\n-\n\nOP\n\n50%\n\n50%\n\n-\n\nUAs\n\n50%\n\n50%\n\n-\n\nRate Table Local Pricing\n\nOON\n\nIN\n\nOON\n\nDetails\n\nNotes\n\n3rd Party\nRepricing\n\nSummary\n\nInformation Provided by\nRep Name Ryan. U\n\nCompany FL Blue\n\nRef # 1-54101900063.\n\nRep Name\n\nCompany\n\nRef #\nEnd Time 07.28 am\n\nA quote of eligibility and benefits does not constitute a guarantee or warranty of payment by the insurance company. Payment of benefits are subject to eligibility, medical necessity, and the terms\nand conditions, limitations, and exclusions of the patient's policy at the time services are rendered, as well as the accuracy of provider's representative. Hansei Solutions is not liable or responsible for\nthe benefits quoted or reported by the insurance company, as each insurer provides its own disclaimers against the accuracy of the information provided. v20001024a"}]